<?xml version="1.0" encoding="UTF-8"?>
<xs:schema xmlns:xs="http://www.w3.org/2001/XMLSchema"
    xmlns="http://tecnologie-web.studenti.math.unipd.it/tecweb/~gpinato"
    targetNamespace="http://tecnologie-web.studenti.math.unipd.it/tecweb/~gpinato"
    elementFormDefault="qualified">

<xs:element name="userlist">
	<xs:complexType>
		<xs:sequence>
			<xs:element name="user" minOccurs="0" maxOccurs="unbounded">
				<xs:complexType>
					<xs:sequence>
						<xs:element name="username" type="xs:string" />
						<xs:element name="password" type="xs:string" />
						<xs:element name="email" type="xs:string" />
					</xs:sequence>
				</xs:complexType>
			</xs:element>
		</xs:sequence>
	</xs:complexType>
</xs:element>

</xs:schema>